Branch,Description,Synonyms|Description,AutoMatches,ContainsMatch,StartsWithMatch,TokenOverlapMatch
Art,"Creative human expression across visual, auditory and performance media; the umbrella discipline for the fine arts",Visual arts | Study of creation of visual forms across media. (?),-,Visual arts | Study of creation of visual forms across media.,-,-
Biology,Science that studies life,Biology | Study of living organisms and life processes.,Biology | Study of living organisms and life processes.,-,-,-
Chemistry,Scientific field of study – study of properties and behaviours of substances.,Chemistry | Study of matter its composition and chemical reactions.,Chemistry | Study of matter its composition and chemical reactions.,-,-,-
Computer science,Study of computation – study of processes that interact with data.,Computer science | Study of computation algorithms and information processing.,Computer science | Study of computation algorithms and information processing.,-,-,-
Cultural studies,"Interdisciplinary analysis of culture, power and identity in everyday life and media",Cultural studies | Study of cultural practices meanings and identities.,Cultural studies | Study of cultural practices meanings and identities.,-,-,-
Ethics,"Philosophical study of moral values, principles and decision-making",Ethics | Study of moral values and principles.,Ethics | Study of moral values and principles.,-,-,-
Geography,Study of lands and inhabitants of Earth – study of surface of the earth and its inhabitants,Geography | Study of places landscapes and spatial relationships on Earth.,Geography | Study of places landscapes and spatial relationships on Earth.,-,-,-
History,Systematic study and interpretation of past events and human activities,History | Study of past events and their interpretation.,History | Study of past events and their interpretation.,-,-,-
Law,System of rules created and enforced through social or governmental institutions to regulate behaviour,Law | Study of systems of law and legal institutions.,Law | Study of systems of law and legal institutions.,-,-,-
Linguistics,Scientific study of language,Linguistics | Study of language structure use and meaning.,Linguistics | Study of language structure use and meaning.,-,-,-
Literary Studies,Study and analysis of written and oral texts as artistic and cultural artefacts,Literature | Study of written texts and literary traditions. (?),-,-,-,-
Literature,Study and analysis of written and oral texts as artistic and cultural artefacts,Literature | Study of written texts and literary traditions.,Literature | Study of written texts and literary traditions.,-,-,-
Logics,Study of correct reasoning,Logic | Study of principles of valid reasoning. (?),-,-,-,-
Mathematics,"Area of knowledge – study of magnitude, number, and forms",Mathematics | Study of numbers structures and abstract patterns.,Mathematics | Study of numbers structures and abstract patterns.,-,-,-
Music theory,"Analytical study of music’s structures, systems and compositional techniques",Music theory | Study of the structures and systems of music.,Music theory | Study of the structures and systems of music.,-,-,-
Philosophy,Study of general and fundamental questions – science of knowledge or wisdom [citation needed][relevant?],Philosophy | Study of fundamental questions about reality knowledge and values.,Philosophy | Study of fundamental questions about reality knowledge and values.,-,-,-
Physics,Scientific field of study,Physics | Study of matter energy and fundamental forces.,Physics | Study of matter energy and fundamental forces.,-,-,-
Psychology,Study of mental functions and behaviors,Psychology | Study of mind behavior and mental processes.,Psychology | Study of mind behavior and mental processes.,-,-,-
Abiology,"Study of abiotic matter and physicochemical processes that occur independently of life, including those that may have preceded its origin",X,-,-,-,-
Abiophysiology,"Investigation of life-like physicochemical processes in non-living systems, especially as models for physiology",Physiology | Study of functions of living organisms. (?),-,-,-,-
Acanthology,Branch of zoology that examines spined or spine-bearing organisms (notably echinoids) and the taxonomic significance of their spines,X,-,-,-,-
Acoustics,Branch of physics involving mechanical waves – the branch of physics studying the properties of sound.,Acoustics | Study of sound and mechanical waves.,Acoustics | Study of sound and mechanical waves.,-,-,-
Actinobiology,Study of effects of radiation on living things – synonymous with radiobiology.,X,-,-,-,-
Aerodynamics,Branch of dynamics concerned with studying the motion of air,Aerodynamics | Study of motion of air and forces on objects.,Aerodynamics | Study of motion of air and forces on objects.,-,-,-
Aerology,Upper-atmosphere branch of meteorology that analyses atmospheric conditions above the planetary boundary layer,X,-,-,-,-
Aerostatics,Study of gases that are not in motion,Statics | Study of forces in systems at rest. (?),-,Statics | Study of forces in systems at rest.,-,-
Aesthetics,"Philosophical field that analyses beauty, taste and the creation or appreciation of art",Aesthetics / Philosophy of art | Study of beauty art and aesthetic experience. (?),-,Aesthetics / Philosophy of art | Study of beauty art and aesthetic experience.,-,-
Agnoiology,"Epistemological study of the varieties, sources and classifications of ignorance and the unknown",X,-,-,-,-
Agonistics,Chemical which binds to and activates a biochemical receptor,X,-,-,-,-
Agrology,"Soil science, study of soils, especially agricultural soils.[9]",Agrology | Study of soils in agricultural contexts.,Agrology | Study of soils in agricultural contexts.,-,-,-
Algebra,Branch of mathematics,Algebra | Study of structures symbols and algebraic systems.,Algebra | Study of structures symbols and algebraic systems.,-,-,-
Apiology,Scientific study of bees,Apiology | Study of bees and bee biology.,Apiology | Study of bees and bee biology.,-,-,-
Art history,"Scholarly study of artworks, artists and artistic movements in their cultural and historical contexts",History | Study of past events and their interpretation. (?),-,-,-,-
Astronomy,Scientific study of celestial objects,Astronomy | Study of celestial objects and the universe.,Astronomy | Study of celestial objects and the universe.,-,-,-
Atmospheric Science,Inter-disciplinary science that investigates the physical and chemical processes of Earth’s atmosphere,Atmospheric science | Study of planetary atmospheres and their dynamics.,Atmospheric science | Study of planetary atmospheres and their dynamics.,-,-,-
Autology,Word that expresses a property it also possesses – scientific study of oneself.[citation needed],X,-,-,-,-
Automata theory,Study of abstract machines and automata,Automata theory (Formal languages) | Study of automata and formal language theory. (?),-,Automata theory (Formal languages) | Study of automata and formal language theory.,-,-
Barology,study of gravitational force.[13],X,-,-,-,-
Biochemistry,Study of chemical processes in living organisms,Biochemistry | Study of chemical processes in living organisms.,Biochemistry | Study of chemical processes in living organisms.,-,-,-
Biophysics,Study of biological systems using methods from the physical sciences – study of physics of biological phenomena.,Biophysics | Study of physical principles in biological systems.,Biophysics | Study of physical principles in biological systems.,-,-,-
Botany,Study of plant life,Botany | Study of plants and plant biology.,Botany | Study of plants and plant biology.,-,-,-
Chaology,Field of mathematics and science based on non-linear systems and initial conditions,Chaos theory | Study of chaotic behavior in dynamical systems. (?),-,-,-,-
Chaos theory,Field of mathematics and science based on non-linear systems and initial conditions,Chaos theory | Study of chaotic behavior in dynamical systems.,Chaos theory | Study of chaotic behavior in dynamical systems.,-,-,-
Chorology (geography),"Study of regional causal relationships between physical geographic phenomena (e.g., how topography, climate and soils interact within a delimited area)",Geography | Study of places landscapes and spatial relationships on Earth. (?),-,Geography | Study of places landscapes and spatial relationships on Earth.,-,-
Classical mechanics,Description of large objects' physics – study of motion of macroscopic objects.,Classical mechanics | Study of motion under classical physics laws.,Classical mechanics | Study of motion under classical physics laws.,-,-,-
Comparative literature,"Literary discipline comparing texts across languages, cultures and periods",Comparative literature | Study of literature across cultures and languages.,Comparative literature | Study of literature across cultures and languages.,-,-,-
Earth Science,includes all fields of natural science related to the planet Earth.[1],Earth science | Study of Earth systems and physical processes.,Earth science | Study of Earth systems and physical processes.,-,-,-
Embryology,Branch of biology studying prenatal biology,Embryology | Study of embryos and early development.,Embryology | Study of embryos and early development.,-,-,-
Engineering,"Profession applying scientific principles to design, build and optimise systems, structures and devices",Technology | Study of engineering and technological applications of physics. (?),-,-,-,-
Enigmatology,Problem or enigma that tests – study of enigmas (puzzles).[relevant?],X,-,-,-,-
Fluid statics,Branch of fluid mechanics that studies fluids at rest – study of fluids behaviour at rest.,Fluid statics | Study of fluids at rest and pressure forces.,Fluid statics | Study of fluids at rest and pressure forces.,-,-,-
Food science,"Study of the physical, chemical and biological properties of food and food processing",Food science | Study of food composition processing and safety.,Food science | Study of food composition processing and safety.,-,-,-
Forensic science,Application of science to criminal and civil laws – the use of scientific methods or expertise to investigate crimes or examine evidence that might be presented in a court of law,Forensic science | Study of applying science to legal investigations.,Forensic science | Study of applying science to legal investigations.,-,-,-
Genetics,"Science of genes, heredity, and variation in living organisms",Genetics | Study of genes heredity and variation.,Genetics | Study of genes heredity and variation.,-,-,-
Geology,Scientific study of Earth's physical composition – study of the rocks of a planet,Geology | Study of Earth materials structure and history.,Geology | Study of Earth materials structure and history.,-,-,-
Geomatics,"Technology-driven discipline for acquiring, processing and visualising geospatial information",Geomatics | Study of measuring and analyzing spatial data.,Geomatics | Study of measuring and analyzing spatial data.,-,-,-
Geomatics engineering,"Technology-driven discipline for acquiring, processing and visualising geospatial information",Geomatics | Study of measuring and analyzing spatial data. (?),-,Geomatics | Study of measuring and analyzing spatial data.,-,-
Geometry,"Branch of mathematics – study the sizes, shapes, positions, angles and dimensions of things.",Geometry and Topology | Study of shapes spaces and topological properties. (?),-,Geometry and Topology | Study of shapes spaces and topological properties.,-,-
Geoscience,includes all fields of natural science related to the planet Earth.[1],Earth science | Study of Earth systems and physical processes. (?),-,-,-,-
GIS,"Technology-driven discipline for acquiring, processing and visualising geospatial information",Geographic information systems | Study of spatial data systems and geographic analysis. (?),-,-,-,-
Glossology,Scientific study of language – study of language; study of the tongue,X,-,-,-,-
Googology,Numbers significantly larger than those used regularly – study of large numbers,X,-,-,-,-
Historiography,Study of the methods used by historians,History | Study of past events and their interpretation. (?),-,-,-,-
Historiology,The study of history.,History | Study of past events and their interpretation. (?),-,-,-,-
Iatrology,treatise or text on medical topics; study of medicine [citation needed],Medicine and health | Study of medicine healthcare and human health. (?),-,-,-,-
Ideogeny,study of origins of ideas [citation needed],X,-,-,-,-
Idiomology,"study of idiom, jargon or dialect [citation needed][relevant?]",Linguistics | Study of language structure use and meaning. (?),-,-,-,-
Information science,Academic field concerned with collection and analysis of information,Information science | Study of information organization retrieval and use.,Information science | Study of information organization retrieval and use.,-,-,-
Information security,"Discipline protecting information assets against unauthorised access, disclosure or modification",Computer security and reliability | Study of secure and reliable computing systems. (?),-,-,-,-
Innovation Studies,"Handled as synonym for ""Thought process for making the strange familiar and the familiar strange – study of processes of invention""",X,-,-,-,-
Japanology,"Area studies focused on Japan – The study of Japan, its language, culture and history[29]",Japanology (Japanese studies) | Study of Japan and Japanese society and culture. (?),-,Japanology (Japanese studies) | Study of Japan and Japanese society and culture.,-,-
Kinematics,Branch of physics describing the motion of objects without considering forces – study of motion,Kinematics | Study of motion without regard to forces.,Kinematics | Study of motion without regard to forces.,-,-,-
Kinetics,Subfield of physics – study of forces producing or changing motion,Kinetics | Study of motion with forces and energies.,Kinetics | Study of motion with forces and energies.,-,-,-
Library and information science,"Branch of academic disciplines – study of organization, access, collection, and protection/regulation of information, whether in physical or digital forms.[citation needed]",Library and museum studies | Study of library and museum information practices. (?),-,-,-,-
Library science,Branch of academic disciplines – study of collection of information [citation needed],Library and museum studies | Study of library and museum information practices. (?),-,-,-,-
Ludology,Study of games and the act of playing them,Game studies | Study of games as media forms and cultural practices. (?),-,-,-,-
Materials science,"Interdisciplinary field exploring the properties, performance and applications of materials",Materials engineering | Study of engineering of materials and their properties. (?),-,-,-,-
Mechanics,Science concerned with physical bodies subjected to forces or displacements,Mechanics | Study of motion forces and physical systems.,Mechanics | Study of motion forces and physical systems.,-,-,-
Medicine,"Diagnosis, treatment, and prevention of illness[relevant?]",Medicine and health | Study of medicine healthcare and human health. (?),-,-,-,-
Melology,Scholarly study of music – study of music; musicology [relevant?],Musicology | Study of music. (?),-,-,-,-
Mereology,Study of parts and the wholes they form – study of part-whole relationships,X,-,-,-,-
Metaphysics,Study of fundamental reality – study of principles of nature and thought [relevant?],Metaphysics | Study of fundamental nature of reality and being.,Metaphysics | Study of fundamental nature of reality and being.,-,-,-
Metapsychology,Psychological aspect – study of nature of the mind [citation needed][relevant?],Psychology | Study of mind behavior and mental processes. (?),-,-,-,-
Microbiology,Study of microscopic organisms (microbes),Microbiology | Study of microorganisms and microbial processes.,Microbiology | Study of microorganisms and microbial processes.,-,-,-
Morphology,study of forms and the development of structures [relevant?],Morphology | Study of the structure and formation of words.,Morphology | Study of the structure and formation of words.,-,-,-
Musicology,Scholarly study of music – study of music [relevant?],Musicology | Study of music.,Musicology | Study of music.,-,-,-
Navigation,Process of monitoring and controlling the movement of a craft or vehicle from one place to another – study of controlling a movement of a vehicle from one place to another[relevant?],Navigation | Study of methods for determining position and route.,Navigation | Study of methods for determining position and route.,-,-,-
Neutrosophy,study of the origin and nature of philosophical neutralities [citation needed][relevant?],X,-,-,-,-
Noology,Spanish philosopher (1898–1983) – science of the intellect [citation needed],Psychology | Study of mind behavior and mental processes. (?),-,-,-,-
Onomastics,Study of proper names[relevant?],Linguistics | Study of language structure use and meaning. (?),-,-,-,-
Optics,Branch of physics that studies light,Optics | Study of light and its interactions with matter.,Optics | Study of light and its interactions with matter.,-,-,-
Organic chemistry,"Chemistry branch focused on the structure, properties and reactions of carbon-based compounds",Organic chemistry | Study of carbon-based compounds and reactions.,Organic chemistry | Study of carbon-based compounds and reactions.,-,-,-
Palaeography,"Study of ancient and historical handwriting forms to date, read and contextualise manuscripts",Philology | Study of historical texts and language through manuscripts. (?),-,-,-,-
Paleography,"Study of ancient and historical handwriting forms to date, read and contextualise manuscripts",Philology | Study of historical texts and language through manuscripts. (?),-,-,-,-
Paradoxology,Logically self-contradictory statement – study of paradoxes [citation needed],Logic | Study of principles of valid reasoning. (?),-,-,-,-
Paroemiology,study of proverbs[citation needed],Literature | Study of written texts and literary traditions. (?),-,-,-,-
Particle physics,Study of subatomic particles and forces,Particle physics | Study of fundamental particles and forces.,Particle physics | Study of fundamental particles and forces.,-,-,-
Performing arts,"Creative disciplines (music, theatre, dance, etc.) presented live for an audience",Performing arts | Study of live performance disciplines such as dance theatre and film.,Performing arts | Study of live performance disciplines such as dance theatre and film.,-,-,-
Phenomenology,Philosophical method and schools of philosophy – study of phenomena [citation needed][relevant?],Phenomenology | Study of subjective experience and conscious phenomena.,Phenomenology | Study of subjective experience and conscious phenomena.,-,-,-
Philology,Study of language in historical sources,Philology | Study of historical texts and language through manuscripts.,Philology | Study of historical texts and language through manuscripts.,-,-,-
Philosophy of science,"Critical inquiry into the foundations, methods and implications of scientific practice",Philosophy of physical sciences | Study of philosophical foundations of the physical sciences. (?),-,-,-,-
Phonology,Study of sound organization in languages,Phonology | Study of sound systems and patterns in language.,Phonology | Study of sound systems and patterns in language.,-,-,-
Phraseology,Linguistic study of phrases[relevant?],Linguistics | Study of language structure use and meaning. (?),-,-,-,-
Phytology,Study of plant life,Botany | Study of plants and plant biology. (?),-,-,-,-
Pseudology,art or science of lying [citation needed][relevant?],X,-,-,-,-
Punnology,study of puns[39],Linguistics | Study of language structure use and meaning. (?),-,-,-,-
Quantum mechanics,Description of physical properties at the atomic and subatomic scale – a fundamental theory in physics which describes nature at the smallest scales of energy levels of atoms and subatomic particles[citation needed],Quantum mechanics | Study of physical behavior at atomic scales.,Quantum mechanics | Study of physical behavior at atomic scales.,-,-,-
Quantum physics,Description of physical properties at the atomic and subatomic scale – the study of matter and energy at the most fundamental level[citation needed],Quantum physics | Study of physical phenomena at quantum scales.,Quantum physics | Study of physical phenomena at quantum scales.,-,-,-
Radiochemistry,Chemistry of radioactive materials – study of ordinary chemical reactions under radioactive circumstances[citation needed],Radiochemistry | Study of radioactive substances and reactions.,Radiochemistry | Study of radioactive substances and reactions.,-,-,-
Religion,Study of the nature of deities and religious beliefs - study of religion[citation needed][relevant?],Religion | Study of religious beliefs practices and institutions in general.,Religion | Study of religious beliefs practices and institutions in general.,-,-,-
Schematonics,art of using gesture to express tones [citation needed][relevant?],X,-,-,-,-
Scientific modelling,Scientific activity that produces models – study of application of models to understand a particular problem [citation needed],Scientific thinking | Study of scientific reasoning and methods. (?),-,-,-,-
Scientific programming,Language for communicating instructions to a machine – study of programming [citation needed][relevant?],Scientific computing (Computational science) | Study of computational methods for scientific problems. (?),-,-,-,-
Semantics,Study of meaning in language,Semantics | Study of meaning in language and symbols.,Semantics | Study of meaning in language and symbols.,-,-,-
Semantology,science of meanings of words [citation needed],Semantics | Study of meaning in language and symbols. (?),-,-,-,-
Significs,Linguistic and philosophical term – science of meaning[citation needed] [relevant?],Semantics | Study of meaning in language and symbols. (?),-,-,-,-
Sinology,Area studies focused on China,Sinology | Study of China and Chinese language and culture.,Sinology | Study of China and Chinese language and culture.,-,-,-
Sociology,Social science that studies human society and its development,Sociology | Study of society social institutions and relationships.,Sociology | Study of society social institutions and relationships.,-,-,-
Soil Science,"Soil science, study of soils, especially agricultural soils.[9]",Edaphology / Pedology or Soil science | Study of soils and soil formation processes. (?),-,Edaphology / Pedology or Soil science | Study of soils and soil formation processes.,-,-
Spectrology,Study involving matter and electromagnetic radiation,Spectroscopy | Study of spectra to determine composition and motion. (?),-,-,-,-
Spectroscopy,Study involving matter and electromagnetic radiation – study of spectra,Spectroscopy | Study of spectra to determine composition and motion.,Spectroscopy | Study of spectra to determine composition and motion.,-,-,-
Statics,Branch of mechanics concerned with balance of forces in nonmoving systems,Statics | Study of forces in systems at rest.,Statics | Study of forces in systems at rest.,-,-,-
Statistics,"discipline that concerns the collection, organization, analysis, interpretation, and presentation of data.[2]",Statistics | Study of data collection analysis and inference.,Statistics | Study of data collection analysis and inference.,-,-,-
Stereochemistry,Subdiscipline of chemistry – study of chemistry of the relative spatial arrangement of atoms that form the structure of molecules and their manipulation. [citation needed],Chemistry | Study of matter its composition and chemical reactions. (?),-,-,-,-
Surveying,"Technology-driven discipline for acquiring, processing and visualising geospatial information",Surveying | Study of measuring and mapping land and structures.,Surveying | Study of measuring and mapping land and structures.,-,-,-
Synectics,Thought process for making the strange familiar and the familiar strange – study of processes of invention,X,-,-,-,-
Syntax,System responsible for combining morphemes into complex structures – study of sentence structure,Syntax | Study of sentence structure and grammatical rules.,Syntax | Study of sentence structure and grammatical rules.,-,-,-
Taxonomy,"Science of naming, defining and classifying organisms",Taxonomy | Study of naming and classifying organisms.,Taxonomy | Study of naming and classifying organisms.,-,-,-
Technology,"application of conceptual knowledge to achieve practical goals, especially in a reproducible way.",Technology | Study of engineering and technological applications of physics.,Technology | Study of engineering and technological applications of physics.,-,-,-
Technology Studies,"application of conceptual knowledge to achieve practical goals, especially in a reproducible way.",Science studies/Science and technology studies | Study of science and technology as social practices. (?),-,Science studies/Science and technology studies | Study of science and technology as social practices.,-,-
Teleology,Thinking in terms of destiny or purpose – study of final causes; analysis in terms of purpose[citation needed][relevant?],Teleology | Study of purpose and goal directedness in nature and action.,Teleology | Study of purpose and goal directedness in nature and action.,-,-,-
Theology,Study of the nature of deities and religious beliefs - study of religion[citation needed][relevant?],Theology | Study of theological doctrines and systematic beliefs.,Theology | Study of theological doctrines and systematic beliefs.,-,-,-
Theoretical computer science,Subfield of computer science and mathematics,Theoretical computer science | Study of theoretical foundations of computation.,Theoretical computer science | Study of theoretical foundations of computation.,-,-,-
