Branch,Description,Synonyms|Description,AutoMatches,ContainsMatch,StartsWithMatch,TokenOverlapMatch
Andragogy,Methods and principles in adult education,-,-,-,-,-
Anemology,Study of winds – study of wind.,-,-,-,-,-
Anthropology,"Scientific study of humans, human behavior, and societies – study of human cultures.",-,Anthropology | Study of humans cultures and societies.,Anthropology of Religion | Study of religion through anthropological approaches.; Anthropology | Study of humans cultures and societies.; Biocultural anthropology | Study of interactions between biology culture and health.; Biological anthropology | Study of human biology and evolution.; Paleoanthropology | Study of human evolution through fossil evidence.; Evolutionary anthropology | Study of human evolution using evolutionary theory.; Forensic anthropology | Study of human remains for legal investigation.; Medical anthropology | Study of health and medicine in cultural contexts.; Molecular anthropology | Study of human evolution using molecular data.; Neuroanthropology | Study of brain and culture interactions.; Nutritional anthropology | Study of nutrition in cultural and biological contexts.; Linguistic anthropology | Study of language in social and cultural contexts.; Sociocultural anthropology | Study of social and cultural aspects of human life.; Semiotic anthropology | Study of signs and meaning in cultural contexts.; Cultural anthropology | Study of cultural practices and meanings in societies.; Anthropology of development | Study of development processes through anthropology.; Anthropology of religion | Study of religion in cultural contexts.; Applied anthropology | Study of applying anthropology to practical problems.; Cognitive anthropology | Study of cultural influences on cognition.; Cyborg anthropology | Study of human technology integration and culture.; Digital anthropology | Study of digital cultures and online communities.; Ecological anthropology | Study of human ecology and environmental adaptation.; Economic anthropology | Study of economic behavior in cultural contexts.; Environmental anthropology | Study of culture in relation to environmental issues.; Feminist anthropology | Study of anthropology through feminist perspectives.; Legal anthropology | Study of law and legal systems in cultural contexts.; Political anthropology | Study of power politics and authority in societies.; Political economic anthropology | Study of political economy in cultural contexts.; Psychological anthropology | Study of psychological processes within cultural contexts.; Public anthropology | Study of applying anthropology to public issues.; Symbolic anthropology | Study of symbols meanings and cultural interpretation.; Transpersonal anthropology | Study of transcendent experiences in cultural contexts.; Urban anthropology | Study of urban life and culture.; Social anthropology | Study of social structures and cultural practices.; Anthropology of art | Study of art and aesthetics in cultural contexts.; Anthropology of institutions | Study of social institutions and their cultural roles.; Anthropology of media | Study of media practices and cultural production.; Visual anthropology | Study of visual culture and representation in societies.; Systems theory in anthropology | Study of systems theory applied to anthropology.,Anthropology of Religion | Study of religion through anthropological approaches.; Anthropology | Study of humans cultures and societies.; Anthropology of development | Study of development processes through anthropology.; Anthropology of religion | Study of religion in cultural contexts.; Anthropology of art | Study of art and aesthetics in cultural contexts.; Anthropology of institutions | Study of social institutions and their cultural roles.; Anthropology of media | Study of media practices and cultural production.,-
Aquatic ecology,The study of interactions between organisms and the environment in water,-,-,-,-,-
Archology,study of the nature of government – science of the origins of government.,-,-,-,-,-
Areology,"Scientific study of the surface, crust, and interior of the planet Mars",-,-,-,-,-
Aromachology,Study of the influence of odors on human behavior,-,-,-,-,-
Astheniology,Physical symptom – study of diseases of weakening and aging.,-,-,-,-,-
Astrobotany,Study of plants grown in spacecraft,-,Astrobotany | Study of plant biology in extraterrestrial contexts.,Astrobotany | Study of plant biology in extraterrestrial contexts.,Astrobotany | Study of plant biology in extraterrestrial contexts.,-
Astronautics,Theory and practice of navigation beyond the Earth's atmosphere,-,Astronautics | Study of spaceflight and spacecraft systems.,Astronautics | Study of spaceflight and spacecraft systems.,Astronautics | Study of spaceflight and spacecraft systems.,-
Autecology,Study of interactions of individual organisms with the environment,-,-,-,-,-
Ballistics,Science of the motion of projectiles,-,Ballistics | Study of projectile motion and dynamics.,Ballistics | Study of projectile motion and dynamics.,Ballistics | Study of projectile motion and dynamics.,-
Balneology,Method of treating diseases by bathing – science of the therapeutic use of baths.,-,-,-,-,-
Barodynamics,science of the support and mechanics of heavy structures[12],-,-,-,-,-
Bathymetry,Study of underwater depth of lake or ocean floors,-,-,-,-,-
Batrachology,Branch of herpetology that studies amphibians,-,Batrachology | Study of amphibians and their biology.,Batrachology | Study of amphibians and their biology.,Batrachology | Study of amphibians and their biology.,-
Behavioral neuroscience,Study of biological and neural mechanisma in behaviour,-,Behavioral neuroscience | Study of neural bases of behavior.,Behavioral neuroscience | Study of neural bases of behavior.,Behavioral neuroscience | Study of neural bases of behavior.,Behavioral neuroscience | Study of neural bases of behavior.
Bioecology,Study of interrelations of plants and animals with their environment,-,-,-,-,-
Biomechanics,Study of the mechanics of biological systems,-,Biomechanics | Study of mechanics of living organisms.,Biomechanics | Study of mechanics of living organisms.; Biomechanics / Sports biomechanics | Study of mechanics of movement and sports performance.,Biomechanics | Study of mechanics of living organisms.; Biomechanics / Sports biomechanics | Study of mechanics of movement and sports performance.,-
Bionomics (economics),"Less commonly, the application of biological analogies to economic systems—state which sense is intended",-,-,-,-,-
Biopsychology,Study of biological and neural mechanisma in behaviour – application of the science of biology to the study of psychology.,-,-,-,-,-
Biotribology,"Study of friction, wear and lubrication in biological systems – study of friction, wear and lubrication of biological systems.",-,-,-,-,-
Bryology,Branch of botany concerned with the study of bryophytes – study of mosses and liverworts.,-,-,Embryology | Study of embryos and early development.,-,-
Business,"Applied social-science field analysing how organisations create value, manage resources and interact with markets",-,Business | Study of business organization and economic enterprise.,Business law | Study of laws affecting business operations and commerce.; Business English | Study of English usage in business and professional contexts.; Business | Study of business organization and economic enterprise.; Business administration | Study of managing business operations and resources.; Business analysis | Study of analyzing business needs and performance.; Business ethics | Study of ethical issues in business practice.; Business law | Study of legal issues affecting business.; Business management | Study of managing organizations and business strategy.; E-Business | Study of conducting business using digital platforms.; Information systems (Business informatics) | Study of information systems in business contexts.; Business economics | Study of economic analysis applied to business.; Business studies | Study of business organization and management.,Business law | Study of laws affecting business operations and commerce.; Business English | Study of English usage in business and professional contexts.; Business | Study of business organization and economic enterprise.; Business administration | Study of managing business operations and resources.; Business analysis | Study of analyzing business needs and performance.; Business ethics | Study of ethical issues in business practice.; Business law | Study of legal issues affecting business.; Business management | Study of managing organizations and business strategy.; Business economics | Study of economic analysis applied to business.; Business studies | Study of business organization and management.,-
Business studies,"Applied social-science field analysing how organisations create value, manage resources and interact with markets",-,Business studies | Study of business organization and management.,Business studies | Study of business organization and management.,Business studies | Study of business organization and management.,Business studies | Study of business organization and management.
Caliology,Place where a bird broods its eggs – study of bird's nests.,-,-,-,-,-
Cambistry,science of international exchange.[15],-,-,-,-,-
Campanology,Scientific and musical study of bells,-,-,-,-,-
Cardiology,Branch of medicine dealing with the heart,-,Cardiology | Study of heart and cardiovascular diseases.,Cardiology | Study of heart and cardiovascular diseases.,Cardiology | Study of heart and cardiovascular diseases.,-
Catallactics,Theory about the free market system in economies – science of commercial exchange.,-,-,-,-,-
Catechectics,art of teaching by question and answer.[citation needed][relevant?],-,-,-,-,-
Cetology,"The study of whales, dolphins, porpoises, and other cetaceans – study of whales and dolphins.",-,Cetology | Study of whales dolphins and porpoises.,Cetology | Study of whales dolphins and porpoises.,Cetology | Study of whales dolphins and porpoises.,-
Chiropody,Medicine branch focusing on the human lower extremities,-,-,-,-,-
Chorology (biogeography),Study of the spatial distribution patterns of organisms and the environmental factors shaping those patterns – an early synonym of biogeography,-,-,-,-,-
Chrematistics,Economics theory studying money – study of wealth; political economy.,-,-,-,-,-
Chronobiology,Study of rhythms in biological processes of living organisms – study of biological rhythms.,-,Chronobiology | Study of biological rhythms and timing.,Chronobiology | Study of biological rhythms and timing.,Chronobiology | Study of biological rhythms and timing.,-
Civics,study of the civil and political rights and obligations of citizens in a society.[1],-,Civics | Study of civic rights duties and participation in governance.,Civics | Study of civic rights duties and participation in governance.,Civics | Study of civic rights duties and participation in governance.,-
Clinology,study of aging or individual decline after maturity.[citation needed],-,-,-,-,-
Cognitive science,Interdisciplinary scientific study of cognitive processes,-,Cognitive science | Study of mind and cognition using computational models.,Cognitive science | Study of mind and cognition using computational models.,Cognitive science | Study of mind and cognition using computational models.,Cognitive science | Study of mind and cognition using computational models.
Coleopterology,Branch of entomology studying beetles,-,-,-,-,-
Cometology,study of comets.[16],-,-,-,-,-
Conchology,Study of mollusc shells,-,Conchology | Study of mollusk shells.,Conchology | Study of mollusk shells.,Conchology | Study of mollusk shells.,-
Connectomics,Study of mapping wiring diagrams,-,-,-,-,-
Contact mechanics,Study of the deformation of solids that touch each other,-,-,-,-,-
Ctetology,study of the inheritance of acquired characteristics.[citation needed],-,-,-,-,-
Curriculum studies,concentration in the different types of curriculum and instruction concerned with understanding curricula as an active force influenced by human educational experiences.[1],-,-,-,-,-
Cybernetics,Transdisciplinary field concerned with regulatory and purposive systems,-,Cybernetics | Study of control and communication in systems.,Sociocybernetics | Study of social systems using cybernetics concepts.; Cybernetics | Study of control and communication in systems.; Biocybernetics | Study of cybernetic models of biological systems.; Engineering cybernetics | Study of cybernetics applied to engineering systems.; Management cybernetics | Study of cybernetic approaches to management systems.; Medical cybernetics | Study of cybernetic systems in medicine.; New Cybernetics | Study of second generation cybernetics concepts.; Second-order cybernetics | Study of cybernetics of observing systems.; Sociocybernetics | Study of cybernetic models of social systems.; Pharmacocybernetics | Study of cybernetic systems applied to drug therapy.,Cybernetics | Study of control and communication in systems.,-
Cyclonology,"study of tropical cyclones, e.g. hurricanes.[citation needed]",-,-,-,-,-
Dactyliology,study of finger rings.[17][relevant?],-,-,-,-,-
Dactylography,Scientific study of fingerprints,-,-,-,-,-
Dactylology,Form of communication using one or both hands – study of sign language.[citation needed],-,-,-,-,-
Demography,"Science that deals with populations and their structures, statistically and theoretically",-,Demography | Study of population statistics and dynamics.,Demography/Population | Study of population size structure and dynamics.; Demography | Study of population statistics and dynamics.,Demography/Population | Study of population size structure and dynamics.; Demography | Study of population statistics and dynamics.,-
Dendrochronology,Method of dating based on the analysis of patterns of tree rings,-,Dendrochronology | Study of tree ring dating for archaeological timelines.,Dendrochronology | Study of tree ring dating for archaeological timelines.,Dendrochronology | Study of tree ring dating for archaeological timelines.,-
Dendrology,Science and study of woody plants,-,-,-,-,-
Dermatoglyphics,Scientific study of finger- and toeprints,-,-,-,-,-
Dermatology,"Field of medicine dealing with the hair, nails, skin, and its diseases",-,Dermatology | Study of skin diseases and dermatological care.,Dermatology | Study of skin diseases and dermatological care.,Dermatology | Study of skin diseases and dermatological care.,-
Desmology,Study of ligaments,-,-,-,-,-
Didactic method,"theory of teaching, and in a wider sense, a theory and practical application of teaching and learning. In demarcation from ""mathetics"" (the science of learning), didactics refers only to the science of teaching.",-,-,-,-,-
Dietetics,Study of diet and nutrition in relation to health and disease,-,-,Nutrition and dietetics | Study of diet nutrition and therapeutic diets.,-,-
Diplomatics,Academic study of the protocols of documents – science of deciphering ancient writings and texts.[citation needed],-,-,-,-,-
Dosiology,study of dosage of drugs.[19],-,-,-,-,-
Eccrinology,Sweat gland distributed almost all over the human body – study of excretion.,-,-,-,-,-
Ekistics,Science of human settlements,-,-,-,-,-
Electrodynamics,"Fundamental interaction between charged particles – study of the effects arising from the interactions of electric currents with magnets, with other currents, or with themselves.",-,-,Quantum electrodynamics | Study of quantum theory of electromagnetism.,-,-
Electrohydrodynamics,Study of electrically conducting fluids in the presence of electric fields – the study of dynamics of electrically charged fluids.,-,-,-,-,-
Electromagnetism,Fundamental interaction between charged particles – study of electromagnetic force.,-,Electromagnetism | Study of electric and magnetic field interactions.,Electromagnetism | Study of electric and magnetic field interactions.,Electromagnetism | Study of electric and magnetic field interactions.,-
Electrostatics,Study of stationary or slow-moving electric charges – study of static electricity.,-,-,-,-,-
Emmenology,study of menstruation.[21],-,-,-,-,-
Endemiology,study of local diseases.[citation needed],-,-,-,-,-
Entozoology,study of parasites that live inside larger organisms.[22],-,-,-,-,-
Environmental science,"study of the environment, and the solution of environmental problems.",-,Environmental science | Study of the environment and human impacts.,Environmental science | Study of the environment and human impacts.,Environmental science | Study of the environment and human impacts.,Environmental science | Study of the environment and human impacts.
Ephebiatrics,Medical subspecialty for adolescents – branch of medicine dealing with adolescence.,-,-,-,-,-
Eremology,study of deserts.[23],-,-,-,-,-
Escapology,Practice of escaping from restraints – study of freeing oneself from constraints.[relevant?],-,Escapology | Study of escape performance and physical skill.,Escapology | Study of escape performance and physical skill.,Escapology | Study of escape performance and physical skill.,-
Ethonomics,"Personal value, basis for ethical action – study of economic and ethical principles of a society.",-,-,-,-,-
Etiology,"Study of causation, or origination",-,-,-,-,-
Euthenics,Study of improving living conditions to increase well-being – science concerned with improving living conditions.,-,-,-,-,-
Exoplanetology,study of exoplanets.,-,Exoplanetology | Study of planets beyond the Solar System.,Exoplanetology | Study of planets beyond the Solar System.,Exoplanetology | Study of planets beyond the Solar System.,-
Felinology,Study of cats – study of felines.,-,Felinology | Study of cats and feline biology.,Felinology | Study of cats and feline biology.,Felinology | Study of cats and feline biology.,-
Fluviology,study of watercourses.[25],-,-,-,-,-
Forestry,"Science and craft of managing woodlands – study of the creation, management, use, conservation, and repair of forests and associated resources.",-,Forestry | Study of forest management and ecology.,Forestry | Study of forest management and ecology.; Environmental studies and forestry | Study of environmental studies and forestry management.,Forestry | Study of forest management and ecology.,-
Fracture mechanics,Study of propagation of cracks in materials,-,Fracture mechanics | Study of crack formation and material failure.,Fracture mechanics | Study of crack formation and material failure.,Fracture mechanics | Study of crack formation and material failure.,Fracture mechanics | Study of crack formation and material failure.
Gastroenterology,Branch of medicine focused on the digestive system and its disorders,-,Gastroenterology | Study of digestive system disorders.,Gastroenterology | Study of digestive system disorders.,Gastroenterology | Study of digestive system disorders.,-
Gerocomy,study of old age[citation needed],-,-,-,-,-
Glaciology,Scientific study of ice and natural phenomena involving ice,-,Glaciology | Study of glaciers and ice sheets.; Glaciology | Study of glaciers within hydrological systems.,Glaciology | Study of glaciers and ice sheets.; Glaciology | Study of glaciers within hydrological systems.,Glaciology | Study of glaciers and ice sheets.; Glaciology | Study of glaciers within hydrological systems.,-
Gnomonics,science that studies sundials – the art of measuring time using sundials,-,-,-,-,-
Graphemics,Study of graphemes and writing systems – study of systems of representing speech in writing,-,-,-,-,-
Gromatics,Ancient Roman land surveyors – science of surveying,-,-,-,-,-
Gyrostatics,study of rotating bodies[citation needed],-,-,-,-,-
Haemataulics,study of movement of blood through blood vessels[citation needed],-,-,-,-,-
Halieutics,study of fishing[26],-,-,-,-,-
Helminthology,Study of parasitic worms (helminths),-,Helminthology | Study of parasitic worms.,Helminthology | Study of parasitic worms.,Helminthology | Study of parasitic worms.,-
Hematology,Study of blood and blood diseases,-,Hematology | Study of blood and blood disorders.,Cytohematology | Study of blood cell analysis at the cellular level.; Hematology | Study of blood and blood disorders.,Hematology | Study of blood and blood disorders.,-
Hemodynamics,Dynamics of blood flow – study of the dynamics behind blood circulation,-,-,-,-,-
Hermeology,study of Mercury,-,-,-,-,-
Hippiatrics,study of diseases of horses[citation needed],-,-,-,-,-
Histology,Study of the microscopic anatomy of cells and tissues of plants and animals,-,Histology | Study of tissues and microscopic anatomy.; Histology | Study of tissues in clinical diagnostics.,Histology | Study of tissues and microscopic anatomy.; Histology | Study of tissues in clinical diagnostics.,Histology | Study of tissues and microscopic anatomy.; Histology | Study of tissues in clinical diagnostics.,-
Home economics,Study of household management,-,-,-,-,-
Horticulture,Small-scale cultivation of plants – study of gardening [citation needed],-,Horticulture | Study of garden and crop cultivation.,Horticulture | Study of garden and crop cultivation.,Horticulture | Study of garden and crop cultivation.,-
Hydraulics,"Applied engineering involving liquids – study of application of engineering, chemistry and other fields of science involving the use of liquids [citation needed]",-,Hydraulics | Study of water flow and hydraulic systems.,Hydraulics | Study of water flow and hydraulic systems.,Hydraulics | Study of water flow and hydraulic systems.,-
Hydrobiology,Science of life and life processes in water – study of aquatic organisms,-,-,-,-,-
Hydrodynamics,Study of liquids in motion,-,Hydrodynamics | Study of fluid motion in liquids.; Hydrodynamics | Study of fluid dynamics in astrophysical systems.,Hydrodynamics | Study of fluid motion in liquids.; Hydrodynamics | Study of fluid dynamics in astrophysical systems.; Magnetohydrodynamics | Study of magnetic fluids in astrophysical systems.,Hydrodynamics | Study of fluid motion in liquids.; Hydrodynamics | Study of fluid dynamics in astrophysical systems.,-
Hydrogeology,Study of the distribution and movement of groundwater,-,-,Hydrology / Limnology / Hydrogeology | Study of water systems surface and groundwater.,-,-
Hydrography,Measurement of bodies of water,-,-,Hydrology/Hydrography | Study of water distribution movement and properties.,-,-
Hydrokinetics,study of motion of fluids,-,-,-,-,-
Hydrometeorology,Branch of meteorology and hydrology – study of atmospheric moisture [citation needed],-,-,-,-,-
Hydrostatics,Branch of fluid mechanics that studies fluids at rest,-,-,-,-,-
Hyetology,science of rainfall[citation needed],-,-,-,-,-
Hygiastics,science of health and hygiene [citation needed],-,-,-,-,-
Hygienics,Practices performed to preserve health – study of sanitation; health [citation needed],-,-,-,-,-
Hygiology,hygienics; study of cleanliness [citation needed],-,-,-,-,-
Hypnology,Study of sleep and hypnotic phenomena – study of sleep; study of hypnosis.[28],-,-,-,-,-
Hypsography,Measurement of the elevation and depth of features on Earth's surface relative to mean sea level. – science of measuring heights[citation needed],-,-,-,-,-
Iamatology,"Obsolete synonym of the Systematic study of therapeutic remedies (called Aceology), covering principles, efficacy and modes of treatment",-,-,-,-,-
Ichnography,Architectural diagram showing interior layout of a building – art of drawing ground plans; a ground plan,-,-,-,-,-
Ichnology,Study of trace fossils,-,-,-,-,-
Ideology,Set of beliefs or values – science of ideas; system of ideas used to justify behaviour [citation needed],-,-,-,-,-
Immunochemistry,Study of the chemistry of the immune system.,-,Immunochemistry | Study of chemical aspects of immune processes.,Immunochemistry | Study of chemical aspects of immune processes.,Immunochemistry | Study of chemical aspects of immune processes.,-
Immunogenetics,Branch of medical genetics that studies genetic interactions related to the immune system – study of genetic characteristics of immunity,-,-,-,-,-
Immunopathology,Branch of medicine that deals with immune responses associated with disease,-,-,-,-,-
International relations,"Social-science field analysing political, economic and legal interactions among states and other actors",-,International relations | Study of relations between states and global actors.,International relations | Study of relations between states and global actors.,International relations | Study of relations between states and global actors.,International relations | Study of relations between states and global actors.
Karstology,Scientific study of the various aspects of karst regions,-,-,-,-,-
Karyology,Photographic display of total chromosome complement in a cell – study of cell nuclei,-,-,-,-,-
Kymatology,"Branch of physics concerned with the mechanics of fluids (liquids, gases, and plasmas) – study of wave motion",-,-,-,-,-
Laryngology,Medical specialty that deals with the larynx,-,-,Otolaryngology | Study of ear nose and throat disorders.,-,-
Lepidopterology,Branch of entomology that studies moths and butterflies,-,-,-,-,-
Leprology,The study of leprosy and its treatment,-,-,-,-,-
Lichenology,Branch of mycology that studies lichens,-,-,-,-,-
Limnology,Science of inland aquatic ecosystems,-,Limnology | Study of inland waters such as lakes and rivers.; Limnology | Study of inland waters and freshwater ecosystems.,Limnology | Study of inland waters such as lakes and rivers.; Limnology | Study of inland waters and freshwater ecosystems.; Hydrology / Limnology / Hydrogeology | Study of water systems surface and groundwater.,Limnology | Study of inland waters such as lakes and rivers.; Limnology | Study of inland waters and freshwater ecosystems.,-
